{
  "brand": "Spider Farmer",
  "series": "G",
  "model": "G4500",
  "revision": 2026,
  "status": "active",
  "fixture_role": "primary_grow_light",
  "is_primary_fixture_default": true,
  "supplemental_type": "primary_full_spectrum",
  "include_in_default_dli_calculator": true,
  "power_watts": 320.0,
  "ppf_umol_s": 913.0,
  "efficacy_umol_j": 2.85,
  "ppfd_umol_m2_s": null,
  "ppfd_distance_cm": null,
  "ppfd_source_note": null,
  "area_width_cm": 120.0,
  "area_depth_cm": 60.0,
  "technical_source_url": "https://spiderfarmer.eu/collections/led-grow-light/g-series-led-grow-light/",
  "source_type": "manufacturer",
  "source_date": "2026-06-27",
  "confidence_level": "B",
  "notes": "EU collection/product data; footprint class 2x4 ft",
  "uvp_amount": 289.99,
  "uvp_currency": "EUR",
  "uvp_source_url": "https://spiderfarmer.eu/products/g4500-320w-led-grow-light/",
  "uvp_source_type": "manufacturer",
  "uvp_source_date": "2026-06-27",
  "uvp_confidence_level": "B",
  "uvp_notes": "Original price seen on official EU snippet; current price can differ"
}