{
  "brand": "AC Infinity",
  "series": "IONGRID",
  "model": "IONGRID T22",
  "revision": "current",
  "status": "active",
  "fixture_role": "primary_grow_light",
  "is_primary_fixture_default": true,
  "supplemental_type": "primary_full_spectrum",
  "include_in_default_dli_calculator": true,
  "power_watts": 130.0,
  "ppf_umol_s": null,
  "efficacy_umol_j": 2.7,
  "ppfd_umol_m2_s": null,
  "ppfd_distance_cm": null,
  "ppfd_source_note": null,
  "area_width_cm": 61.0,
  "area_depth_cm": 61.0,
  "technical_source_url": "https://www.thehydrobros.com/products/ac-infinity-iongrid-t22-130w-led-grow-light",
  "source_type": "retailer",
  "source_date": "2026-06-27",
  "confidence_level": "B",
  "notes": "IONGRID S22/T22 generation mentioned in official blog; exact watt/specs need verification before calculator use. | Targeted non-Growbee searches suggest old IONGRID S22/T22 2x2 generation around 130W, but PPF/PPE was not captured; upgraded from D to C only, not B. | [Recherche 2026-06-27] Technik ergaenzt: efficacy_umol_j; Konfidenz C->B | T22 130W rated 2.7 umol/J (consistent retailer/mfr sources). PPF/PPFD not published. Coverage 2x2 ft already set.",
  "uvp_amount": null,
  "uvp_currency": null,
  "uvp_source_url": null,
  "uvp_source_type": null,
  "uvp_source_date": null,
  "uvp_confidence_level": "D",
  "uvp_notes": "UVP/MSRP not verified yet; column intentionally present for later completion"
}