{
  "brand": "ViparSpectra",
  "series": "P Series",
  "model": "P4000",
  "revision": "updated/current",
  "status": "active",
  "fixture_role": "primary_grow_light",
  "is_primary_fixture_default": true,
  "supplemental_type": "primary_full_spectrum",
  "include_in_default_dli_calculator": true,
  "power_watts": 450.0,
  "ppf_umol_s": 1215.0,
  "efficacy_umol_j": 2.7,
  "ppfd_umol_m2_s": null,
  "ppfd_distance_cm": null,
  "ppfd_source_note": null,
  "area_width_cm": 150.0,
  "area_depth_cm": 120.0,
  "technical_source_url": "https://www.viparspectra.com/collections/led-grow-light",
  "source_type": "manufacturer",
  "source_date": "2026-06-27",
  "confidence_level": "B",
  "notes": "Official US collection lists Updated P4000 450W; Amazon.de page found. Older sources list P4000 400W, so revision matters. | PPE 2.7 µmol/J applied as ViparSpectra P-Series family value; PPF derived as power_watts × 2.7, verify exact revision before A-confidence.",
  "uvp_amount": 279.99,
  "uvp_currency": "USD",
  "uvp_source_url": "https://www.viparspectra.com/collections/led-grow-light",
  "uvp_source_type": "manufacturer",
  "uvp_source_date": "2026-06-27",
  "uvp_confidence_level": "B",
  "uvp_notes": "Official US collection current list price."
}