{
  "brand": "Lux Light International",
  "series": "Growbee category",
  "model": "CATEGORY_PLACEHOLDER__manual_review_required",
  "revision": "growbee category listed",
  "status": "needs_research",
  "fixture_role": "category_placeholder",
  "is_primary_fixture_default": "unknown",
  "supplemental_type": "manual_review_required",
  "include_in_default_dli_calculator": false,
  "power_watts": null,
  "ppf_umol_s": null,
  "efficacy_umol_j": null,
  "ppfd_umol_m2_s": null,
  "ppfd_distance_cm": null,
  "ppfd_source_note": null,
  "area_width_cm": null,
  "area_depth_cm": null,
  "technical_source_url": "https://growbee.de/led-grow-beleuchtung-lux-light-international",
  "source_type": "retailer",
  "source_date": "2026-06-27",
  "confidence_level": "D",
  "notes": "Growbee navigation lists this LED Grow Beleuchtung manufacturer, but product rows were not retrievable in this run. Placeholder prevents forgetting the brand; replace with actual product rows after page fetch. | Marked as category placeholder; not usable as a fixture until a real product row is researched.",
  "uvp_amount": null,
  "uvp_currency": null,
  "uvp_source_url": "https://growbee.de/led-grow-beleuchtung-lux-light-international",
  "uvp_source_type": "retailer",
  "uvp_source_date": "2026-06-27",
  "uvp_confidence_level": "D",
  "uvp_notes": "Price not verified."
}