{
  "brand": "SANlight",
  "series": "EVO Series",
  "model": "EVO 4-80",
  "revision": 1.5,
  "status": "active",
  "fixture_role": "primary_grow_light",
  "is_primary_fixture_default": true,
  "supplemental_type": "primary_full_spectrum",
  "include_in_default_dli_calculator": true,
  "power_watts": 265.0,
  "ppf_umol_s": 795.0,
  "efficacy_umol_j": 3.0,
  "ppfd_umol_m2_s": null,
  "ppfd_distance_cm": null,
  "ppfd_source_note": null,
  "area_width_cm": 80.0,
  "area_depth_cm": 80.0,
  "technical_source_url": "https://www.amazon.de/sanlight-EVO-265W-1-5-4-80/dp/B0CSSN7GGX",
  "source_type": "marketplace",
  "source_date": "2026-06-27",
  "confidence_level": "B",
  "notes": "Amazon.de listing title: EVO 4 265W 1.5 4-80 for 80x80cm. PPF not exposed in accessible snippet. | SANlight EVO family marketed at >3 µmol/J; stored as 3.0 and PPF derived from wattage where exact model PPF was missing. Verify model/revision before A-confidence.",
  "uvp_amount": 478.95,
  "uvp_currency": "EUR",
  "uvp_source_url": "https://www.amazon.de/sanlight-EVO-265W-1-5-4-80/dp/B0CSSN7GGX",
  "uvp_source_type": "marketplace",
  "uvp_source_date": "2026-06-27",
  "uvp_confidence_level": "C",
  "uvp_notes": "Amazon.de observed marketplace price; not official MSRP."
}