{
  "brand": "Caluma",
  "series": "LED Stripe",
  "model": "LED Stripe Bloom",
  "revision": "listed by Caluma",
  "status": "active",
  "fixture_role": "supplemental_light",
  "is_primary_fixture_default": false,
  "supplemental_type": "strip_supplemental",
  "include_in_default_dli_calculator": false,
  "power_watts": 18.0,
  "ppf_umol_s": null,
  "efficacy_umol_j": null,
  "ppfd_umol_m2_s": null,
  "ppfd_distance_cm": null,
  "ppfd_source_note": null,
  "area_width_cm": null,
  "area_depth_cm": null,
  "technical_source_url": "https://www.caluma.net/led-stripe-bloom/",
  "source_type": "manufacturer",
  "source_date": "2026-06-27",
  "confidence_level": "B",
  "notes": "Official Caluma page lists 18 W, 3000 K, 1600 lm, 60 cm; PPF/PPE not published. | Marked as strip/bar supplemental light; exclude from default primary canopy fixture comparisons.",
  "uvp_amount": null,
  "uvp_currency": null,
  "uvp_source_url": "https://www.caluma.net/licht/",
  "uvp_source_type": "retailer",
  "uvp_source_date": "2026-06-27",
  "uvp_confidence_level": "D",
  "uvp_notes": null
}