{
  "brand": "ViparSpectra",
  "series": "XS Series",
  "model": "XS1500",
  "revision": "legacy",
  "status": "discontinued",
  "fixture_role": "primary_grow_light",
  "is_primary_fixture_default": true,
  "supplemental_type": "primary_full_spectrum",
  "include_in_default_dli_calculator": true,
  "power_watts": 150.0,
  "ppf_umol_s": 279.7,
  "efficacy_umol_j": null,
  "ppfd_umol_m2_s": 776.9,
  "ppfd_distance_cm": 36.5,
  "ppfd_source_note": null,
  "area_width_cm": 60.0,
  "area_depth_cm": 60.0,
  "technical_source_url": "https://www.cocoforcannabis.com/grow-light-guide/viparspectra-xs-1500-par-test-review/",
  "source_type": "independent_test",
  "source_date": "2026-06-27",
  "confidence_level": "B",
  "notes": "Official blog product parameters list XS1500 150W ±5%; legacy XS model, not XS1500 Pro. PPF/PPE not verified. | [Recherche 2026-06-27] ASIN B08CH9DSSB verifiziert (Titel: VIPARSPECTRA XS1500 LED Grow Light, Samsung LM301B Diodes, MeanWell Driver, Dimmable Full Spectrum); Technik ergaenzt: ppf_umol_s,ppfd_umol_m2_s,ppfd_distance_cm; Konfidenz C->B | cocoforcannabis PAR test (legacy LM301B): usable PPF 279.7, PPFD 776.9 @36.5cm over 60x60, 1.83umol/w @153W. amazon.de B08CH9DSSB=LM301B version (unopened, title-matched).",
  "uvp_amount": null,
  "uvp_currency": null,
  "uvp_source_url": "https://www.viparspectra.com/blogs/home-grower/best-led-grow-lights-2021-viparspectra-xs-series",
  "uvp_source_type": "manufacturer",
  "uvp_source_date": "2026-06-27",
  "uvp_confidence_level": "D",
  "uvp_notes": "UVP not verified."
}