{
  "brand": "Mars Hydro",
  "series": "FC-E",
  "model": "FC-E3000",
  "revision": 2026,
  "status": "active",
  "fixture_role": "primary_grow_light",
  "is_primary_fixture_default": true,
  "supplemental_type": "primary_full_spectrum",
  "include_in_default_dli_calculator": true,
  "power_watts": 300.0,
  "ppf_umol_s": 840.0,
  "efficacy_umol_j": 2.8,
  "ppfd_umol_m2_s": null,
  "ppfd_distance_cm": null,
  "ppfd_source_note": null,
  "area_width_cm": 90.0,
  "area_depth_cm": 90.0,
  "technical_source_url": "https://marshydro.eu/products/mars-hydro-fc-e-3000-led-grow-light/",
  "source_type": "manufacturer",
  "source_date": "2026-06-27",
  "confidence_level": "A",
  "notes": "Manufacturer/source snippets: PPF 840 µmol/s, PPE 2.8 µmol/J, veg 90x90cm / flower 80x80cm.",
  "uvp_amount": 545.99,
  "uvp_currency": "EUR",
  "uvp_source_url": "https://marshydro.eu/products/mars-hydro-fc-e-3000-led-grow-light/",
  "uvp_source_type": "manufacturer",
  "uvp_source_date": "2026-06-27",
  "uvp_confidence_level": "B",
  "uvp_notes": "Upper bound from official price range snippets; may include add-on/controller variant."
}