{
  "brand": "AC Infinity",
  "series": "Supplemental",
  "model": "IONBEAM U4",
  "revision": "current",
  "status": "active",
  "fixture_role": "supplemental_light",
  "is_primary_fixture_default": false,
  "supplemental_type": "uv_supplemental",
  "include_in_default_dli_calculator": false,
  "power_watts": 30.0,
  "ppf_umol_s": null,
  "efficacy_umol_j": null,
  "ppfd_umol_m2_s": null,
  "ppfd_distance_cm": null,
  "ppfd_source_note": null,
  "area_width_cm": null,
  "area_depth_cm": null,
  "technical_source_url": "https://acinfinity.com/ionbeam-u4-supplemental-grow-light-bars-11-targeted-uv-spectrum-led-4-bar-kit/",
  "source_type": "manufacturer",
  "source_date": "2026-06-27",
  "confidence_level": "A",
  "notes": "Supplemental UV 4-bar set; targeted UVA 365/395 nm; exact watt not verified in extracted text. | Official AC Infinity technical specs list IONBEAM U4 wattage 30 W; UV supplemental, no fixture PPF/PPE provided. | Marked as UV supplemental light; exclude from default primary-light comparisons and handle as supplemental spectrum/DLI only. | [Recherche 2026-06-27] ASIN B0C51PFY6T verifiziert (Titel: AC Infinity IONBEAM U4 UV LED Strip 28 cm, 4-Way - 365/395 nm LEDs with Timer Dimmer (amazon.de)) | amazon.de listing 'IONBEAM U4 UV LED 4-Way 365/395nm' matches 4-bar kit. No PPF/eff/PPFD published by manufacturer.",
  "uvp_amount": 89.99,
  "uvp_currency": "USD",
  "uvp_source_url": "https://acinfinity.com/led-supplemental-lighting/",
  "uvp_source_type": "manufacturer",
  "uvp_source_date": "2026-06-27",
  "uvp_confidence_level": "A",
  "uvp_notes": "Official AC Infinity listed price"
}