{
  "brand": "Spider Farmer",
  "series": "SE",
  "model": "SE5000",
  "revision": "manual",
  "status": "active",
  "fixture_role": "primary_grow_light",
  "is_primary_fixture_default": true,
  "supplemental_type": "primary_full_spectrum",
  "include_in_default_dli_calculator": true,
  "power_watts": 480.0,
  "ppf_umol_s": 1420.0,
  "efficacy_umol_j": 2.9,
  "ppfd_umol_m2_s": null,
  "ppfd_distance_cm": null,
  "ppfd_source_note": null,
  "area_width_cm": 91.0,
  "area_depth_cm": 91.0,
  "technical_source_url": "https://manuals.plus/spider-farmer/se-series-led-grow-light-manual",
  "source_type": "manual_pdf",
  "source_date": "2026-06-27",
  "confidence_level": "A",
  "notes": "Core 3x3 ft; max 4x4 ft",
  "uvp_amount": null,
  "uvp_currency": null,
  "uvp_source_url": null,
  "uvp_source_type": null,
  "uvp_source_date": null,
  "uvp_confidence_level": "D",
  "uvp_notes": "UVP/MSRP not verified yet; column intentionally present for later completion"
}