{
  "brand": "Spider Farmer",
  "series": "Supplemental",
  "model": "GlowBar 40W",
  "revision": 2026,
  "status": "active",
  "fixture_role": "supplemental_light",
  "is_primary_fixture_default": false,
  "supplemental_type": "full_spectrum_supplemental",
  "include_in_default_dli_calculator": false,
  "power_watts": 40.0,
  "ppf_umol_s": null,
  "efficacy_umol_j": 2.2,
  "ppfd_umol_m2_s": null,
  "ppfd_distance_cm": null,
  "ppfd_source_note": null,
  "area_width_cm": 110,
  "area_depth_cm": 40,
  "technical_source_url": "https://www.spider-farmer.com/collections/led-grow-light/veg-light/glowbar-light/",
  "source_type": "manufacturer",
  "source_date": "2026-06-27",
  "confidence_level": "B",
  "notes": "Full-spectrum strip light; exact PPF not verified | Marked as supplemental/additional light; exclude from standalone primary fixture comparisons unless user intentionally selects supplemental role. | [Recherche 2026-06-27] ASIN B0FRQL1GNR verifiziert (Titel: Spider Farmer SF-GlowBar10D Plant Lamp LED Full Spectrum (3000K+5000K+660nm), 40 W (4x10W) Set of 4); Technik ergaenzt: efficacy_umol_j,area_width_cm,area_depth_cm; Konfidenz C->B | spider-farmer.com: GlowBar 40W (4x10W) full spectrum, PPE>=2.2 umol/J, coverage 110x40cm. ASIN likely (dimmable D vs non-D variant unclear).",
  "uvp_amount": null,
  "uvp_currency": null,
  "uvp_source_url": "https://spiderfarmer.eu/products/40w-full-spectrum-led-grow-light-strips-for-indoor-plantsideal-for-plant-stand-greenhouse/",
  "uvp_source_type": "manufacturer",
  "uvp_source_date": "2026-06-27",
  "uvp_confidence_level": "D",
  "uvp_notes": "Product page found but UVP not verified"
}