{
  "brand": "Flexstar",
  "series": "LTL Collection",
  "model": "LTL 250W Linear Toplight",
  "revision": "current",
  "status": "active",
  "fixture_role": "primary_grow_light",
  "is_primary_fixture_default": true,
  "supplemental_type": "primary_full_spectrum",
  "include_in_default_dli_calculator": true,
  "power_watts": 250.0,
  "ppf_umol_s": 750.0,
  "efficacy_umol_j": 3.0,
  "ppfd_umol_m2_s": null,
  "ppfd_distance_cm": null,
  "ppfd_source_note": null,
  "area_width_cm": null,
  "area_depth_cm": null,
  "technical_source_url": "https://flex-star.com/Flexstar-LINEAR-TOP-LIGHT-SERIES",
  "source_type": "manufacturer",
  "source_date": "2026-06-27",
  "confidence_level": "B",
  "notes": "Homepage product highlight lists LTL Collection 250W Linear Toplight; detailed page fetch was incomplete, PPF/PPE not verified. | PPE filled as conservative 3.0 µmol/J estimate from Flexstar high-efficiency toplight family; PPF derived from wattage, verify product datasheet.",
  "uvp_amount": null,
  "uvp_currency": null,
  "uvp_source_url": "https://flex-star.com/Flexstar-LINEAR-TOP-LIGHT-SERIES",
  "uvp_source_type": "manufacturer",
  "uvp_source_date": "2026-06-27",
  "uvp_confidence_level": "D",
  "uvp_notes": "UVP not verified."
}