{
  "brand": "Spider Farmer",
  "series": "G",
  "model": "G7000",
  "revision": 2026,
  "status": "active",
  "fixture_role": "primary_grow_light",
  "is_primary_fixture_default": true,
  "supplemental_type": "primary_full_spectrum",
  "include_in_default_dli_calculator": true,
  "power_watts": 730.0,
  "ppf_umol_s": 2083.0,
  "efficacy_umol_j": 2.85,
  "ppfd_umol_m2_s": null,
  "ppfd_distance_cm": null,
  "ppfd_source_note": null,
  "area_width_cm": 122.0,
  "area_depth_cm": 122.0,
  "technical_source_url": "https://spiderfarmer.eu/collections/led-grow-light/g-series-led-grow-light/",
  "source_type": "retailer",
  "source_date": "2026-06-27",
  "confidence_level": "B",
  "notes": "Retailer/Amazon data; verify official source",
  "uvp_amount": null,
  "uvp_currency": null,
  "uvp_source_url": null,
  "uvp_source_type": null,
  "uvp_source_date": null,
  "uvp_confidence_level": "D",
  "uvp_notes": "UVP/MSRP not verified yet; column intentionally present for later completion"
}