{
  "brand": "The Jungle Led",
  "series": "The Jackson NEMESIS",
  "model": "The Jackson NEMESIS 150W",
  "revision": "current official listing",
  "status": "active",
  "fixture_role": "primary_grow_light",
  "is_primary_fixture_default": true,
  "supplemental_type": "primary_full_spectrum",
  "include_in_default_dli_calculator": true,
  "power_watts": 150.0,
  "ppf_umol_s": 372.9,
  "efficacy_umol_j": 2.6,
  "ppfd_umol_m2_s": null,
  "ppfd_distance_cm": null,
  "ppfd_source_note": null,
  "area_width_cm": 80,
  "area_depth_cm": 80,
  "technical_source_url": "https://www.growtent.eu/product-eng-6449-Grow-The-Jungle-The-Jackson-NEMESIS-150W-LED-Grow-Lamp-Dimmable-LM282B-PRO-Osram-660nm-405nm.html",
  "source_type": "retailer",
  "source_date": "2026-06-27",
  "confidence_level": "B",
  "notes": "Official The Jungle category lists model and price; technical details/PPF/PPE not stated in parsed category. Product family uses Samsung/Osram LEDs and adjustable drivers. | [Recherche 2026-06-27] Technik ergaenzt: ppf_umol_s,efficacy_umol_j,area_width_cm,area_depth_cm | No amazon.de. growtent.eu: PAR 372.852 umol/s, eff 2.6 umol/J, real 153W, 80x80cm. Reseller data; mfr omits photometrics.",
  "uvp_amount": 175.0,
  "uvp_currency": "EUR",
  "uvp_source_url": "https://www.growthejungle.com/leds-crecimiento-floracion/",
  "uvp_source_type": "manufacturer",
  "uvp_source_date": "2026-06-27",
  "uvp_confidence_level": "B",
  "uvp_notes": "Official The Jungle listed price incl. VAT."
}