{
  "brand": "Lumatek",
  "series": "Zeus Pro 2.9",
  "model": "Zeus 465W Pro 2.9",
  "revision": "current",
  "status": "active",
  "fixture_role": "primary_grow_light",
  "is_primary_fixture_default": true,
  "supplemental_type": "primary_full_spectrum",
  "include_in_default_dli_calculator": true,
  "power_watts": 475.0,
  "ppf_umol_s": 1353.0,
  "efficacy_umol_j": 2.9,
  "ppfd_umol_m2_s": null,
  "ppfd_distance_cm": null,
  "ppfd_source_note": null,
  "area_width_cm": 120.0,
  "area_depth_cm": 120.0,
  "technical_source_url": "https://growbee.de/lumatek-led-zeus-465w-pro-29",
  "source_type": "retailer",
  "source_date": "2026-06-27",
  "confidence_level": "B",
  "notes": "Growbee product page: suitable for 120x120cm, PPF 1353 µmol/s, efficacy up to 2.9 µmol/J, input power 475W +/-5%, OSRAM/Lumileds diodes.",
  "uvp_amount": 1219.0,
  "uvp_currency": "EUR",
  "uvp_source_url": "https://growbee.de/lumatek-led-zeus-465w-pro-29",
  "uvp_source_type": "retailer_uvp",
  "uvp_source_date": "2026-06-27",
  "uvp_confidence_level": "B",
  "uvp_notes": "Growbee lists current price 849.00 EUR and Hersteller-UVP/Alter Preis 1219.00 EUR."
}