{
  "brand": "Lumen-King",
  "series": "Grow Light",
  "model": "LED Grow Light 720W",
  "revision": "growbee listing/current",
  "status": "active",
  "fixture_role": "primary_grow_light",
  "is_primary_fixture_default": true,
  "supplemental_type": "primary_full_spectrum",
  "include_in_default_dli_calculator": true,
  "power_watts": 720.0,
  "ppf_umol_s": 1944.0,
  "efficacy_umol_j": 2.7,
  "ppfd_umol_m2_s": null,
  "ppfd_distance_cm": null,
  "ppfd_source_note": null,
  "area_width_cm": null,
  "area_depth_cm": null,
  "technical_source_url": "https://growbee.de/led-grow-beleuchtung-lumen-king",
  "source_type": "retailer",
  "source_date": "2026-06-27",
  "confidence_level": "A",
  "notes": "Growbee title lists 720W and 2.7; PPF inferred. Old price 399.90 EUR. | [Recherche 2026-06-27] Konfidenz C->A | lumen-king.com 720W Eco Line page confirms PPF 1944 umol/s, 2.7 umol/J, 720W. No PPFD/area published. Not on amazon.de.",
  "uvp_amount": 389.0,
  "uvp_currency": "EUR",
  "uvp_source_url": "https://growbee.de/led-grow-beleuchtung-lumen-king",
  "uvp_source_type": "retailer",
  "uvp_source_date": "2026-06-27",
  "uvp_confidence_level": "C",
  "uvp_notes": "Growbee listed price/old price where available; not necessarily manufacturer UVP."
}