{
  "brand": "AC Infinity",
  "series": "IONFRAME",
  "model": "IONFRAME EVO8",
  "revision": "current",
  "status": "active",
  "fixture_role": "primary_grow_light",
  "is_primary_fixture_default": true,
  "supplemental_type": "primary_full_spectrum",
  "include_in_default_dli_calculator": true,
  "power_watts": 730.0,
  "ppf_umol_s": 2292.2,
  "efficacy_umol_j": 3.14,
  "ppfd_umol_m2_s": null,
  "ppfd_distance_cm": null,
  "ppfd_source_note": null,
  "area_width_cm": 152.0,
  "area_depth_cm": 152.0,
  "technical_source_url": "https://acinfinity.com/ionframe-evo8-grow-light-730w-full-spectrum-led-5x5-coverage/",
  "source_type": "manufacturer",
  "source_date": "2026-06-27",
  "confidence_level": "A",
  "notes": "Official page: 730W, 5x5 ft coverage; Samsung LM301H EVO diodes rated 3.14 µmol/J each, not stored as fixture efficacy. | Official AC Infinity spec includes max PPFD 2013 µmol/(m²·s); this is PPFD, not fixture PPF, so ppf_umol_s remains blank. User requested: efficacy_umol_j set to 3.14 µmol/J from official AC Infinity Samsung LM301H EVO single-diode efficiency; PPF derived as power_watts × 3.14 and should be treated as derived/optimistic rather than verified fixture PPF.",
  "uvp_amount": 799.0,
  "uvp_currency": "USD",
  "uvp_source_url": "https://acinfinity.com/ionframe-evo10-grow-light-1000w-full-spectrum-led-5x5-coverage/",
  "uvp_source_type": "manufacturer",
  "uvp_source_date": "2026-06-27",
  "uvp_confidence_level": "B",
  "uvp_notes": "Official related product listed price"
}