{
  "brand": "Flexstar",
  "series": "Redline Collection",
  "model": "Redline 400W",
  "revision": "current",
  "status": "active",
  "fixture_role": "primary_grow_light",
  "is_primary_fixture_default": true,
  "supplemental_type": "primary_full_spectrum",
  "include_in_default_dli_calculator": true,
  "power_watts": 400.0,
  "ppf_umol_s": 1280.0,
  "efficacy_umol_j": 3.2,
  "ppfd_umol_m2_s": null,
  "ppfd_distance_cm": null,
  "ppfd_source_note": null,
  "area_width_cm": null,
  "area_depth_cm": null,
  "technical_source_url": "https://www.alibaba.com/product-detail/Flexstar-Pro-G2-3-2umol-J_1601341428116.html",
  "source_type": "marketplace_supplier",
  "source_date": "2026-06-27",
  "confidence_level": "B",
  "notes": "Official Redline page states series spans 400W to 1200W, up to 3.2 µmol/J and up to 3840 µmol/s. PPF calculated from max PPE; verify model-specific spec sheet. | Non-Growbee supplier/Alibaba listing found by targeted web query/user example for Flexstar Pro G2 3.2 µmol/J; PPF kept/derived as power_watts × 3.2. Treat as B, not A, because it is a supplier marketplace listing rather than an official datasheet.",
  "uvp_amount": null,
  "uvp_currency": null,
  "uvp_source_url": "https://flex-star.com/Flexstar-REDLINE-SERIES",
  "uvp_source_type": "manufacturer",
  "uvp_source_date": "2026-06-27",
  "uvp_confidence_level": "D",
  "uvp_notes": "UVP not verified."
}