{
  "brand": "The Jungle Led",
  "series": "The Mantis",
  "model": "The Mantis 25W 590mm",
  "revision": "UV-A/UV-B supplemental bar",
  "status": "active",
  "fixture_role": "supplemental_light",
  "is_primary_fixture_default": false,
  "supplemental_type": "uv_supplemental",
  "include_in_default_dli_calculator": false,
  "power_watts": 25.0,
  "ppf_umol_s": null,
  "efficacy_umol_j": null,
  "ppfd_umol_m2_s": null,
  "ppfd_distance_cm": null,
  "ppfd_source_note": null,
  "area_width_cm": null,
  "area_depth_cm": null,
  "technical_source_url": "https://www.growthejungle.com/leds-uv-resinas-terpenos/",
  "source_type": "manufacturer",
  "source_date": "2026-06-27",
  "confidence_level": "B",
  "notes": "Official UV category lists The Mantis 25W 590mm; category explains UV-A/UV-B support for resin/terpenes. PPF/PPE not stated. Growbee page for 25W specifies 405nm/385nm and 1 m² coverage. | Marked as UV supplemental light; exclude from default primary-light comparisons and handle as supplemental spectrum/DLI only.",
  "uvp_amount": 99.95,
  "uvp_currency": "EUR",
  "uvp_source_url": "https://www.growthejungle.com/leds-uv-resinas-terpenos/",
  "uvp_source_type": "manufacturer",
  "uvp_source_date": "2026-06-27",
  "uvp_confidence_level": "B",
  "uvp_notes": "Official The Jungle listed price incl. VAT."
}