{
  "brand": "Mars Hydro",
  "series": "FC-E",
  "model": "FC-E1000W",
  "revision": 2026,
  "status": "active",
  "fixture_role": "primary_grow_light",
  "is_primary_fixture_default": true,
  "supplemental_type": "primary_full_spectrum",
  "include_in_default_dli_calculator": true,
  "power_watts": 1000.0,
  "ppf_umol_s": 2800.0,
  "efficacy_umol_j": 2.8,
  "ppfd_umol_m2_s": null,
  "ppfd_distance_cm": null,
  "ppfd_source_note": null,
  "area_width_cm": null,
  "area_depth_cm": null,
  "technical_source_url": "https://marshydro.eu/products/fc-e-1000w-led-grow-light/",
  "source_type": "manufacturer",
  "source_date": "2026-06-27",
  "confidence_level": "B",
  "notes": "Official product page exists; foldable FC-E1000W. Exact PPF/PPE/coverage not captured in extracted text. | PPE 2.8 µmol/J applied from matching Mars Hydro family/spec pattern; PPF derived as power_watts × 2.8, verify exact product-page revision.",
  "uvp_amount": null,
  "uvp_currency": null,
  "uvp_source_url": "https://marshydro.eu/products/fc-e-1000w-led-grow-light/",
  "uvp_source_type": "manufacturer",
  "uvp_source_date": "2026-06-27",
  "uvp_confidence_level": "D",
  "uvp_notes": "UVP/MSRP not verified."
}