{
  "brand": "AC Infinity",
  "series": "IONFRAME",
  "model": "IONFRAME A7",
  "revision": "current",
  "status": "active",
  "fixture_role": "primary_grow_light",
  "is_primary_fixture_default": true,
  "supplemental_type": "primary_full_spectrum",
  "include_in_default_dli_calculator": true,
  "power_watts": 700.0,
  "ppf_umol_s": null,
  "efficacy_umol_j": 2.8,
  "ppfd_umol_m2_s": 2951,
  "ppfd_distance_cm": null,
  "ppfd_source_note": null,
  "area_width_cm": 122.0,
  "area_depth_cm": 152.0,
  "technical_source_url": "https://acinfinity.com/ionframe-a7-grow-light-700w-full-spectrum-led-4x5-coverage/",
  "source_type": "manufacturer",
  "source_date": "2026-06-27",
  "confidence_level": "A",
  "notes": "Official grow-lights collection lists IONFRAME A7, 700W, 4x5 ft coverage; dedicated specs not fully verified. | [Recherche 2026-06-27] Technik ergaenzt: efficacy_umol_j,ppfd_umol_m2_s; Konfidenz C->A | acinfinity.com lists 2.8 umol/J and center PPFD 2951 (distance unstated); PPF not published. No amazon.de listing found (only amazon.com B0GVGMP55B).",
  "uvp_amount": 499.0,
  "uvp_currency": "USD",
  "uvp_source_url": "https://acinfinity.com/grow-lights/",
  "uvp_source_type": "manufacturer",
  "uvp_source_date": "2026-06-27",
  "uvp_confidence_level": "A",
  "uvp_notes": "Official AC Infinity listed price"
}