{
  "brand": "Mars Hydro",
  "series": "FC",
  "model": "FC4000",
  "revision": "current/EVO listing overlap",
  "status": "active",
  "fixture_role": "primary_grow_light",
  "is_primary_fixture_default": true,
  "supplemental_type": "primary_full_spectrum",
  "include_in_default_dli_calculator": true,
  "power_watts": 320.0,
  "ppf_umol_s": 912.0,
  "efficacy_umol_j": 2.85,
  "ppfd_umol_m2_s": null,
  "ppfd_distance_cm": null,
  "ppfd_source_note": null,
  "area_width_cm": 120.0,
  "area_depth_cm": 60.0,
  "technical_source_url": "https://marshydro.eu/products/fc4000-evo-led-grow-lights/",
  "source_type": "manufacturer",
  "source_date": "2026-06-27",
  "confidence_level": "B",
  "notes": "Source snippets are mixed: FC4000 page mentions Bridgelux 3030 and 2.85 µmol/J; kit/source snippets show 300W±5%, 150x60cm max coverage. Verify model/revision. | PPF derived as power_watts × efficacy_umol_j = 912.0 µmol/s; verify against manufacturer datasheet before final publishing. | [Recherche 2026-06-27] ASIN B0CWNVMQ8X verifiziert (Titel: MARS HYDRO FC4000 LED Grow Light Full Spectrum Samsung LM301H EVO 320 Watt (amazon.de)); Konfidenz C->B | amazon.de 'FC4000 320W Samsung LM301H EVO 2.85 umol/J' bare lamp matches. PPF 912 umol/s & 2.85 umol/J confirmed at marshydro.eu; no PPFD published.",
  "uvp_amount": null,
  "uvp_currency": null,
  "uvp_source_url": "https://marshydro.eu/products/fc4000-evo-led-grow-lights/",
  "uvp_source_type": "manufacturer",
  "uvp_source_date": "2026-06-27",
  "uvp_confidence_level": "D",
  "uvp_notes": "UVP/MSRP not verified."
}