{
  "brand": "Lumen-King",
  "series": "Grow Light",
  "model": "LED Grow Light 465W 2.9",
  "revision": "growbee listing/current",
  "status": "active",
  "fixture_role": "primary_grow_light",
  "is_primary_fixture_default": true,
  "supplemental_type": "primary_full_spectrum",
  "include_in_default_dli_calculator": true,
  "power_watts": 465.0,
  "ppf_umol_s": 1348.5,
  "efficacy_umol_j": 2.9,
  "ppfd_umol_m2_s": null,
  "ppfd_distance_cm": null,
  "ppfd_source_note": null,
  "area_width_cm": null,
  "area_depth_cm": null,
  "technical_source_url": "https://growbee.de/led-grow-beleuchtung-lumen-king",
  "source_type": "retailer",
  "source_date": "2026-06-27",
  "confidence_level": "B",
  "notes": "Growbee title lists 465W and 2.9; PPF inferred. Old price 899.90 EUR. | [Recherche 2026-06-27] Konfidenz C->B | lumen-king.com 465W page: published PPF 1300 umol/s (row 1348.5 is calc), 2.9 umol/J confirmed, 465W. No PPFD/area published. Not on amazon.de.",
  "uvp_amount": 599.0,
  "uvp_currency": "EUR",
  "uvp_source_url": "https://growbee.de/led-grow-beleuchtung-lumen-king",
  "uvp_source_type": "retailer",
  "uvp_source_date": "2026-06-27",
  "uvp_confidence_level": "C",
  "uvp_notes": "Growbee listed price/old price where available; not necessarily manufacturer UVP."
}