{
  "brand": "SANlight",
  "series": "EVO Series",
  "model": "EVO 3-100",
  "revision": 1.5,
  "status": "active",
  "fixture_role": "primary_grow_light",
  "is_primary_fixture_default": true,
  "supplemental_type": "primary_full_spectrum",
  "include_in_default_dli_calculator": true,
  "power_watts": 200.0,
  "ppf_umol_s": 600.0,
  "efficacy_umol_j": 3.0,
  "ppfd_umol_m2_s": null,
  "ppfd_distance_cm": null,
  "ppfd_source_note": null,
  "area_width_cm": 100.0,
  "area_depth_cm": 50.0,
  "technical_source_url": "https://www.amazon.de/s?k=SANlight+EVO+3-100+1.5",
  "source_type": "marketplace",
  "source_date": "2026-06-27",
  "confidence_level": "C",
  "notes": "Amazon.de related listing found; power class from SANlight EVO 3 family. PPF not verified in accessible source. | SANlight EVO family marketed at >3 µmol/J; stored as 3.0 and PPF derived from wattage where exact model PPF was missing. Verify model/revision before A-confidence. | [Recherche 2026-06-27] ASIN B0CST4SMST verifiziert (Titel: sanlight EVO 3 200W 1.5 3-100 for 100 x 100 cm) | Opened amazon.de B0CST4SMST: 'sanlight EVO 3 200W 1.5 3-100 for 100x100' - confirmed exact match. Note: manufacturer lists max PPF 545 umol/s (row shows 600).",
  "uvp_amount": null,
  "uvp_currency": null,
  "uvp_source_url": "https://www.amazon.de/s?k=SANlight+EVO+3-100+1.5",
  "uvp_source_type": "marketplace",
  "uvp_source_date": "2026-06-27",
  "uvp_confidence_level": "D",
  "uvp_notes": "UVP not verified."
}